{"approvalRefs":[{"id":"approval-001","sha256":"ffffffffffffffffffffffffffffffffffffffffffffffffffffffffffffffff"}],"artifacts":[{"contentType":"text/x-diff","id":"artifact-diff-001","kind":"diff","redactionStatus":"redacted","sha256":"3333333333333333333333333333333333333333333333333333333333333333","sizeBytes":120},{"contentType":"application/json","id":"artifact-push-001","kind":"push-receipt","redactionStatus":"not-required","sha256":"4444444444444444444444444444444444444444444444444444444444444444","sizeBytes":80}],"attempt":1,"correlation":{"agentId":"codex","itemId":"KG-TSK-0124","mode":"koa","producerId":"koa-worker","productId":"kano-git-master-skill","requestId":"request-001","routeId":"local-kog","topicId":"kog-agent-first-audit-console","workOrderId":"work-order-001"},"eventCount":2,"eventStreamSha256":"4200a80b5fd8728955a89c00ecb6e3c9b5801a6668a65a426460727cbd3a9895","finishedAtUtc":"2026-07-30T08:00:05Z","firstSequence":1,"lastSequence":2,"parentRunId":null,"planId":"plan-001","planSha256":"cccccccccccccccccccccccccccccccccccccccccccccccccccccccccccccccc","policyRefs":[{"id":"policy-safe-push","sha256":"eeeeeeeeeeeeeeeeeeeeeeeeeeeeeeeeeeeeeeeeeeeeeeeeeeeeeeeeeeeeeeee"}],"repositories":[{"after":{"ahead":0,"behind":0,"branch":"main","dirtyFingerprint":"2222222222222222222222222222222222222222222222222222222222222222","headSha":"bbbbbbbbbbbbbbbbbbbbbbbbbbbbbbbbbbbbbbbb","upstreamHeadSha":"bbbbbbbbbbbbbbbbbbbbbbbbbbbbbbbbbbbbbbbb","worktreeState":"clean"},"before":{"ahead":null,"behind":null,"branch":"main","dirtyFingerprint":"1111111111111111111111111111111111111111111111111111111111111111","headSha":"aaaaaaaaaaaaaaaaaaaaaaaaaaaaaaaaaaaaaaaa","upstreamHeadSha":null,"worktreeState":"dirty"},"id":"repos/kog"}],"runId":"koa-run-001","schemaName":"kog.runReceipt","schemaVersion":1,"startedAtUtc":"2026-07-30T08:00:00Z","terminalOutcome":{"exitCode":0,"reasonCode":null,"retryable":false,"status":"succeeded"}}
